{
  "schema_version": "0.2.0",
  "snapshot_id": "SNAP-ADVANCED_MARKET-001",
  "run_id": "RUN-ADVANCED_MARKET-001",
  "request_id": "REQ-ADVANCED_MARKET-001",
  "source": "FIXTURE",
  "symbol": "XAUUSD",
  "terminal": {
    "terminal_id": "FIXTURE-TERMINAL",
    "account_id": null,
    "server": null,
    "connected": false,
    "trade_write_enabled": false,
    "terminal_build": null
  },
  "capture_time": "2025-02-03T01:40:10Z",
  "broker_time": "2025-02-03T01:40:10Z",
  "broker_utc_offset_minutes": 0,
  "last_tick_time": null,
  "freshness": {
    "status": "FRESH",
    "age_ms": 1000,
    "stale_after_ms": 300000,
    "reasons": []
  },
  "timeframes": [
    {
      "timeframe": "M5",
      "requested_bars": 20,
      "returned_bars": 20,
      "last_closed_bar_time": "2025-02-03T01:40:00Z",
      "bars": [
        {
          "bar_id": "BAR-M5-0001",
          "open_time": "2025-02-03T00:00:00Z",
          "close_time": "2025-02-03T00:05:00Z",
          "open": 100.0,
          "high": 101.0,
          "low": 99.4,
          "close": 100.4,
          "tick_volume": 100,
          "real_volume": null,
          "spread_points": 20,
          "is_closed": true
        },
        {
          "bar_id": "BAR-M5-0002",
          "open_time": "2025-02-03T00:05:00Z",
          "close_time": "2025-02-03T00:10:00Z",
          "open": 100.4,
          "high": 102.0,
          "low": 100.0,
          "close": 101.6,
          "tick_volume": 101,
          "real_volume": null,
          "spread_points": 20,
          "is_closed": true
        },
        {
          "bar_id": "BAR-M5-0003",
          "open_time": "2025-02-03T00:10:00Z",
          "close_time": "2025-02-03T00:15:00Z",
          "open": 101.6,
          "high": 102.2,
          "low": 100.8,
          "close": 101.0,
          "tick_volume": 102,
          "real_volume": null,
          "spread_points": 20,
          "is_closed": true
        },
        {
          "bar_id": "BAR-M5-0004",
          "open_time": "2025-02-03T00:15:00Z",
          "close_time": "2025-02-03T00:20:00Z",
          "open": 101.0,
          "high": 103.0,
          "low": 100.7,
          "close": 102.6,
          "tick_volume": 103,
          "real_volume": null,
          "spread_points": 20,
          "is_closed": true
        },
        {
          "bar_id": "BAR-M5-0005",
          "open_time": "2025-02-03T00:20:00Z",
          "close_time": "2025-02-03T00:25:00Z",
          "open": 102.6,
          "high": 103.1,
          "low": 101.4,
          "close": 101.8,
          "tick_volume": 104,
          "real_volume": null,
          "spread_points": 20,
          "is_closed": true
        },
        {
          "bar_id": "BAR-M5-0006",
          "open_time": "2025-02-03T00:25:00Z",
          "close_time": "2025-02-03T00:30:00Z",
          "open": 101.8,
          "high": 102.9,
          "low": 100.9,
          "close": 102.5,
          "tick_volume": 105,
          "real_volume": null,
          "spread_points": 20,
          "is_closed": true
        },
        {
          "bar_id": "BAR-M5-0007",
          "open_time": "2025-02-03T00:30:00Z",
          "close_time": "2025-02-03T00:35:00Z",
          "open": 102.5,
          "high": 103.0,
          "low": 101.2,
          "close": 101.5,
          "tick_volume": 106,
          "real_volume": null,
          "spread_points": 20,
          "is_closed": true
        },
        {
          "bar_id": "BAR-M5-0008",
          "open_time": "2025-02-03T00:35:00Z",
          "close_time": "2025-02-03T00:40:00Z",
          "open": 101.5,
          "high": 102.0,
          "low": 100.2,
          "close": 100.7,
          "tick_volume": 107,
          "real_volume": null,
          "spread_points": 20,
          "is_closed": true
        },
        {
          "bar_id": "BAR-M5-0009",
          "open_time": "2025-02-03T00:40:00Z",
          "close_time": "2025-02-03T00:45:00Z",
          "open": 100.7,
          "high": 101.1,
          "low": 99.8,
          "close": 100.2,
          "tick_volume": 108,
          "real_volume": null,
          "spread_points": 20,
          "is_closed": true
        },
        {
          "bar_id": "BAR-M5-0010",
          "open_time": "2025-02-03T00:45:00Z",
          "close_time": "2025-02-03T00:50:00Z",
          "open": 100.2,
          "high": 100.7,
          "low": 99.9,
          "close": 100.4,
          "tick_volume": 109,
          "real_volume": null,
          "spread_points": 20,
          "is_closed": true
        },
        {
          "bar_id": "BAR-M5-0011",
          "open_time": "2025-02-03T00:50:00Z",
          "close_time": "2025-02-03T00:55:00Z",
          "open": 100.4,
          "high": 103.2,
          "low": 100.3,
          "close": 102.9,
          "tick_volume": 110,
          "real_volume": null,
          "spread_points": 20,
          "is_closed": true
        },
        {
          "bar_id": "BAR-M5-0012",
          "open_time": "2025-02-03T00:55:00Z",
          "close_time": "2025-02-03T01:00:00Z",
          "open": 103.3,
          "high": 104.6,
          "low": 103.2,
          "close": 104.2,
          "tick_volume": 111,
          "real_volume": null,
          "spread_points": 20,
          "is_closed": true
        },
        {
          "bar_id": "BAR-M5-0013",
          "open_time": "2025-02-03T01:00:00Z",
          "close_time": "2025-02-03T01:05:00Z",
          "open": 104.2,
          "high": 105.0,
          "low": 103.7,
          "close": 104.0,
          "tick_volume": 112,
          "real_volume": null,
          "spread_points": 20,
          "is_closed": true
        },
        {
          "bar_id": "BAR-M5-0014",
          "open_time": "2025-02-03T01:05:00Z",
          "close_time": "2025-02-03T01:10:00Z",
          "open": 104.0,
          "high": 104.8,
          "low": 102.8,
          "close": 103.1,
          "tick_volume": 113,
          "real_volume": null,
          "spread_points": 20,
          "is_closed": true
        },
        {
          "bar_id": "BAR-M5-0015",
          "open_time": "2025-02-03T01:10:00Z",
          "close_time": "2025-02-03T01:15:00Z",
          "open": 103.1,
          "high": 104.2,
          "low": 102.4,
          "close": 103.9,
          "tick_volume": 114,
          "real_volume": null,
          "spread_points": 20,
          "is_closed": true
        },
        {
          "bar_id": "BAR-M5-0016",
          "open_time": "2025-02-03T01:15:00Z",
          "close_time": "2025-02-03T01:20:00Z",
          "open": 103.9,
          "high": 105.1,
          "low": 103.5,
          "close": 104.8,
          "tick_volume": 115,
          "real_volume": null,
          "spread_points": 20,
          "is_closed": true
        },
        {
          "bar_id": "BAR-M5-0017",
          "open_time": "2025-02-03T01:20:00Z",
          "close_time": "2025-02-03T01:25:00Z",
          "open": 104.8,
          "high": 105.2,
          "low": 103.6,
          "close": 104.0,
          "tick_volume": 116,
          "real_volume": null,
          "spread_points": 20,
          "is_closed": true
        },
        {
          "bar_id": "BAR-M5-0018",
          "open_time": "2025-02-03T01:25:00Z",
          "close_time": "2025-02-03T01:30:00Z",
          "open": 104.0,
          "high": 104.7,
          "low": 102.7,
          "close": 103.0,
          "tick_volume": 117,
          "real_volume": null,
          "spread_points": 20,
          "is_closed": true
        },
        {
          "bar_id": "BAR-M5-0019",
          "open_time": "2025-02-03T01:30:00Z",
          "close_time": "2025-02-03T01:35:00Z",
          "open": 103.0,
          "high": 104.0,
          "low": 102.3,
          "close": 103.7,
          "tick_volume": 118,
          "real_volume": null,
          "spread_points": 20,
          "is_closed": true
        },
        {
          "bar_id": "BAR-M5-0020",
          "open_time": "2025-02-03T01:35:00Z",
          "close_time": "2025-02-03T01:40:00Z",
          "open": 103.7,
          "high": 106.8,
          "low": 103.6,
          "close": 106.4,
          "tick_volume": 119,
          "real_volume": null,
          "spread_points": 20,
          "is_closed": true
        }
      ]
    }
  ],
  "account_context": {
    "status": "UNAVAILABLE",
    "currency": null,
    "balance": null,
    "equity": null,
    "margin_free": null,
    "positions": []
  },
  "indicator_evidence": [],
  "evidence_refs": [
    "EVID-ADVANCED_MARKET-001"
  ],
  "qc": {
    "decision": "PASS",
    "checks": [
      {
        "check_id": "QC-CLOSED-BARS",
        "status": "PASS",
        "message": "Fixture closed bars."
      }
    ],
    "warnings": [],
    "errors": []
  },
  "component_versions": {
    "snapshot_service": "fixture-0.2.0"
  }
}